{
  "format": "ilumap",
  "version": 1,
  "meta": {
    "name": "Demo Isles",
    "description": "Reference map for IluMap: a 40 km × 40 km archipelago with a walled river port, an old mine in the northern mountains and an unplaced shrine.",
    "units": "cm",
    "displayUnit": "m",
    "displayUnitScale": 100,
    "flipY": false,
    "landMode": "islands"
  },
  "view": {
    "bounds": {
      "min": [0, 0],
      "max": [4000000, 4000000]
    },
    "grid": {
      "step": 200000,
      "visible": true
    }
  },
  "style": {
    "preset": "blueprint"
  },
  "layers": {
    "land": [
      {
        "id": "island_main",
        "name": "Greater Isle",
        "kind": "polygon",
        "points": [
          [3762500, 2100000],
          [3704200, 2272800],
          [3586800, 2425600],
          [3518300, 2575700],
          [3372800, 2689300],
          [3240200, 2789600],
          [3136500, 2892800],
          [3035800, 2991100],
          [3010000, 3160000],
          [2919000, 3280800],
          [2740900, 3283600],
          [2604100, 3323700],
          [2478600, 3376100],
          [2359400, 3449600],
          [2236000, 3537800],
          [2087300, 3493900],
          [1950000, 3467000],
          [1811600, 3505400],
          [1679400, 3460300],
          [1542700, 3442700],
          [1386300, 3460900],
          [1209000, 3486400],
          [971800, 3564000],
          [793500, 3509200],
          [721900, 3328100],
          [636100, 3178300],
          [579500, 3015800],
          [535100, 2856300],
          [503000, 2699400],
          [582500, 2514800],
          [615100, 2365500],
          [605300, 2232400],
          [694300, 2100000],
          [735800, 1980400],
          [718000, 1854900],
          [658900, 1708300],
          [536200, 1514400],
          [559700, 1356900],
          [687800, 1256600],
          [763700, 1126500],
          [866600, 1016600],
          [969600, 905300],
          [1075700, 791500],
          [1224800, 743200],
          [1340500, 628600],
          [1470000, 517700],
          [1640800, 545400],
          [1797500, 552100],
          [1950000, 535200],
          [2107300, 502600],
          [2279300, 444400],
          [2417000, 560500],
          [2507400, 754200],
          [2604600, 875400],
          [2669000, 1023900],
          [2735300, 1143100],
          [2821100, 1228900],
          [2898700, 1321400],
          [3076200, 1347500],
          [3246200, 1407200],
          [3298800, 1541300],
          [3392200, 1662500],
          [3507400, 1790200],
          [3634500, 1934100]
        ],
        "smooth": true
      },
      {
        "id": "island_gull",
        "name": "Gull Rock",
        "kind": "polygon",
        "points": [
          [3790300, 3420000],
          [3763900, 3560800],
          [3632500, 3614900],
          [3520000, 3648900],
          [3424300, 3585700],
          [3305300, 3544000],
          [3249700, 3420000],
          [3292800, 3288800],
          [3390800, 3196300],
          [3520000, 3229500],
          [3632300, 3225500],
          [3718100, 3305600]
        ],
        "smooth": true
      }
    ],
    "water": [
      {
        "id": "lake_mirror",
        "name": "Mirror Lake",
        "kind": "polygon",
        "points": [
          [1648300, 2275900],
          [1630700, 2394900],
          [1520700, 2441700],
          [1418300, 2425100],
          [1344300, 2364900],
          [1308300, 2275900],
          [1308500, 2160900],
          [1404500, 2084200],
          [1512300, 2136000],
          [1572300, 2199200]
        ],
        "smooth": true
      }
    ],
    "coast": [],
    "rivers": [
      {
        "id": "river_black",
        "name": "Black River",
        "kind": "line",
        "type": "river_main",
        "points": [
          [2183000, 778800],
          [2152700, 1005700],
          [2213400, 1232500],
          [2183100, 1459400],
          [2163600, 1694600],
          [2178400, 1932400],
          [2129500, 2165300],
          [2140400, 2385800],
          [2097700, 2602000],
          [2076900, 2819900],
          [2052600, 2983500],
          [1941200, 3115900],
          [1912200, 3277900],
          [1887700, 3383400],
          [1818900, 3475800],
          [1819700, 3588900]
        ],
        "smooth": true,
        "width": 2500
      },
      {
        "id": "river_silver",
        "name": "Silver Brook",
        "kind": "line",
        "type": "river_minor",
        "points": [
          [931800, 1387000],
          [996000, 1569000],
          [1129600, 1715400],
          [1193900, 1897400],
          [1290700, 1976300],
          [1405800, 2032200],
          [1486800, 2130900]
        ],
        "smooth": true,
        "width": 900
      }
    ],
    "roads": [
      {
        "id": "road_mine_village",
        "name": "Miners Road",
        "kind": "line",
        "type": "road_dirt",
        "points": [
          [2382500, 1172400],
          [2366200, 1336500],
          [2401900, 1500300],
          [2385600, 1664400],
          [2348300, 1780200],
          [2329700, 1901800],
          [2276400, 2012600]
        ],
        "smooth": true,
        "width": 600
      },
      {
        "id": "road_kings",
        "name": "King's Road",
        "kind": "line",
        "type": "road_paved",
        "points": [
          [2276400, 2012600],
          [2302100, 2214800],
          [2327900, 2417100],
          [2237300, 2712400],
          [2107400, 2992700],
          [2014900, 3134500],
          [1888000, 3246700]
        ],
        "smooth": true,
        "width": 900
      },
      {
        "id": "road_forest",
        "name": "Forest Track",
        "kind": "line",
        "type": "path",
        "points": [
          [2276400, 2012600],
          [1991800, 2045700],
          [1707300, 2078800],
          [1495300, 2153100],
          [1274700, 2194900],
          [1179600, 2179400],
          [1097200, 2129800]
        ],
        "smooth": true
      },
      {
        "id": "road_downs",
        "name": "Downs Lane",
        "kind": "line",
        "type": "road_dirt",
        "points": [
          [2276400, 2012600],
          [2511200, 2091100],
          [2746000, 2169600],
          [2871000, 2289600],
          [2970400, 2431500]
        ],
        "smooth": true
      }
    ],
    "rails": [
      {
        "id": "rail_ore",
        "name": "Ore Line",
        "kind": "line",
        "type": "rail",
        "points": [
          [2382500, 1172400],
          [2462400, 1293200],
          [2572700, 1389700],
          [2652600, 1510500],
          [2721200, 1760700],
          [2804100, 2007000],
          [2860600, 2260600],
          [2710100, 2463600],
          [2541900, 2652000],
          [2380900, 2846300],
          [2244400, 3000100],
          [2080200, 3125600],
          [1942200, 3277900]
        ],
        "smooth": true,
        "width": 500
      }
    ],
    "walls": [
      {
        "id": "wall_riverport",
        "name": "Riverport Walls",
        "kind": "line",
        "type": "wall_stone",
        "points": [
          [1906400, 3251700],
          [1937100, 3278700],
          [1933400, 3317000],
          [1904800, 3344100],
          [1868100, 3344100],
          [1837300, 3317000],
          [1841000, 3278700],
          [1869600, 3251700]
        ],
        "closed": true,
        "width": 400,
        "wall": {
          "towers": "vertices",
          "towerSpacing": 5000,
          "towerSize": 900,
          "gates": [
            {
              "id": "gate_riverport_n",
              "name": "North Gate",
              "t": 0.94
            },
            {
              "id": "gate_riverport_s",
              "name": "South Gate",
              "at": 4
            }
          ]
        }
      }
    ],
    "zones": [
      {
        "id": "mountains_north",
        "name": "Northern Mountains",
        "kind": "polygon",
        "type": "mountains",
        "points": [
          [690300, 1641500],
          [703000, 1380000],
          [872100, 1195500],
          [1061500, 1041200],
          [1268300, 919300],
          [1461700, 758500],
          [1710300, 740600],
          [1950000, 698700],
          [2216200, 590400],
          [2429600, 782200],
          [2579900, 1009000],
          [2674900, 1236100],
          [2786200, 1398300],
          [3051100, 1464300],
          [3155300, 1661300],
          [2570900, 1874000],
          [2505500, 1779300],
          [2348300, 1765800],
          [2319800, 1659300],
          [2227800, 1618800],
          [2196200, 1423700],
          [2068300, 1428900],
          [1950000, 1367800],
          [1835100, 1448400],
          [1700000, 1413200],
          [1604900, 1502300],
          [1531500, 1601300],
          [1400100, 1638600],
          [1402300, 1783800],
          [1302200, 1864200]
        ],
        "smooth": true,
        "tags": ["ore"]
      },
      {
        "id": "forest_west",
        "name": "Westwood",
        "kind": "polygon",
        "type": "forest",
        "points": [
          [822100, 3046400],
          [757300, 2788600],
          [732800, 2543000],
          [782500, 2305900],
          [834100, 2100000],
          [841500, 1904500],
          [715000, 1650500],
          [1372200, 1830600],
          [1415000, 1956700],
          [1431200, 2054600],
          [1412400, 2147000],
          [1349800, 2260800],
          [1390100, 2361100],
          [1332100, 2532700]
        ],
        "smooth": true
      },
      {
        "id": "swamp_south",
        "name": "Saltmarsh",
        "kind": "polygon",
        "type": "swamp",
        "points": [
          [1726900, 3365400],
          [1585700, 3291500],
          [1419600, 3291400],
          [1175000, 3389900],
          [906000, 3436300],
          [836400, 3213600],
          [1437300, 2612700],
          [1403800, 2799100],
          [1582200, 2712200],